# Ralph Wiggin Loop v2 Log
Started: 2026-01-15 08:38:10
Input: plans/03-action-system
Mode: folder
Max Iterations: 1
Max Turns: unlimited
Continue Session: false
JSON Status: false

---

[2026-01-15 08:38:10] Starting Ralph loop v2 (MODE: folder) with: plans/03-action-system
[2026-01-15 08:38:10] Max iterations: 1
[2026-01-15 08:38:10] Session continuity: false
[2026-01-15 08:38:10] Log file: ralph-log-20260115-083810.txt
[2026-01-15 08:38:10] 
JSON_STATUS: {
  "ralph_status": {
    "status": "starting",
    "session_id": "",
    "totals": {
      "cost": "0",
      "input_tokens": 0,
      "output_tokens": 0,
      "duration_ms": 0
    },
    "progress": {
      "iterations_completed": 0,
      "current_subplan": 0,
      "total_subplans": 0,
      "current_file": ""
    },
    "timestamp": "2026-01-15T08:38:10+00:00"
  }
}
[2026-01-15 08:38:10] Folder mode: Found 9 sub-plans
[2026-01-15 08:38:10]   1. 01-type-definitions.md
[2026-01-15 08:38:10]   2. 02-action-engine.md
[2026-01-15 08:38:10]   3. 03-keyboard-handler.md
[2026-01-15 08:38:10]   4. 04-launch-handler.md
[2026-01-15 08:38:10]   5. 05-script-handler.md
[2026-01-15 08:38:10]   6. 06-http-handler.md
[2026-01-15 08:38:10]   7. 07-media-handler.md
[2026-01-15 08:38:10]   8. 08-system-handler.md
[2026-01-15 08:38:10]   9. 09-event-binder.md
[2026-01-15 08:38:10] Starting from sub-plan 1
JSON_STATUS: {
  "ralph_status": {
    "status": "running",
    "session_id": "",
    "totals": {
      "cost": "0",
      "input_tokens": 0,
      "output_tokens": 0,
      "duration_ms": 0
    },
    "progress": {
      "iterations_completed": 0,
      "current_subplan": 1,
      "total_subplans": 9,
      "current_file": ""
    },
    "timestamp": "2026-01-15T08:38:10+00:00"
  }
}
[2026-01-15 08:38:10] 
[2026-01-15 08:38:10] ============================================================
[2026-01-15 08:38:10] === Iteration 1/1 ===
[2026-01-15 08:38:10] === Sub-plan 1/9: 01-type-definitions.md ===
[2026-01-15 08:38:10] === Sub-plan iteration: 1 ===
[2026-01-15 08:38:10] ============================================================
JSON_STATUS: {
  "ralph_status": {
    "status": "running",
    "session_id": "",
    "totals": {
      "cost": "0",
      "input_tokens": 0,
      "output_tokens": 0,
      "duration_ms": 0
    },
    "progress": {
      "iterations_completed": 0,
      "current_subplan": 1,
      "total_subplans": 9,
      "current_file": "01-type-definitions.md"
    },
    "timestamp": "2026-01-15T08:38:10+00:00"
  }
}
[2026-01-15 08:38:10] Launching Claude with prompt from: plans/03-action-system/01-type-definitions.md
[2026-01-15 08:38:10] [VERBOSE] Prompt length: 1349 characters
[2026-01-15 08:38:10] [VERBOSE] Claude args: --output-format json --dangerously-skip-permissions
[2026-01-15 08:41:00] Session: cf6c9e8c-0b4f-4111-af5e-91c3a3e9b6f9
[2026-01-15 08:41:00] Cost: $0.0000 | Tokens: 2 in / 7862 out | Duration: 2m 45s
[2026-01-15 08:41:00] Running totals: $0.0000 | 2 in / 7862 out
[2026-01-15 08:41:00] Result preview: Task 3.1 is complete. All verification criteria met:

1. ✅ `src/shared/types/actions.ts` exists - Contains base action interface, all specific action types (KeyboardAction, LaunchAction, ScriptAction, HttpAction, MediaAction, SystemAction, ProfileAction, TextAction), union type Action, and execution result types
2. ✅ `src/core/actions/schemas.ts` exists - Contains Zod validation schemas for all action types with discriminated union support
3. ✅ `npm run build` succeeds
4. ✅ STATUS.md upd...
=== FULL CLAUDE OUTPUT (iteration 1) ===
Task 3.1 is complete. All verification criteria met:

1. ✅ `src/shared/types/actions.ts` exists - Contains base action interface, all specific action types (KeyboardAction, LaunchAction, ScriptAction, HttpAction, MediaAction, SystemAction, ProfileAction, TextAction), union type Action, and execution result types
2. ✅ `src/core/actions/schemas.ts` exists - Contains Zod validation schemas for all action types with discriminated union support
3. ✅ `npm run build` succeeds
4. ✅ STATUS.md updated with results

<promise>SUBPLAN_1_COMPLETE</promise>
=== END OUTPUT ===

[2026-01-15 08:41:00] Completion detected: SUBPLAN_1_COMPLETE promise tag
[2026-01-15 08:41:00] Completion detected in iteration 1
[2026-01-15 08:41:00] Sub-plan 1 COMPLETE! Advancing to next sub-plan.
JSON_STATUS: {
  "ralph_status": {
    "status": "subplan_complete",
    "session_id": "cf6c9e8c-0b4f-4111-af5e-91c3a3e9b6f9",
    "totals": {
      "cost": "0",
      "input_tokens": 2,
      "output_tokens": 7862,
      "duration_ms": 165733
    },
    "progress": {
      "iterations_completed": 1,
      "current_subplan": 2,
      "total_subplans": 9,
      "current_file": ""
    },
    "timestamp": "2026-01-15T08:41:00+00:00"
  }
}
[2026-01-15 08:41:02] Single iteration mode - stopping after first iteration
[2026-01-15 08:41:02] 
[2026-01-15 08:41:02] ============================================================
[2026-01-15 08:41:02] === FOLDER MODE COMPLETE ===
[2026-01-15 08:41:02] ============================================================
[2026-01-15 08:41:02] Ralph loop stopped after 1 iterations
[2026-01-15 08:41:02] Stopped at sub-plan 2/9
[2026-01-15 08:41:02] Final stats: $0.0000 | 2 in / 7862 out | 2m 45s
[2026-01-15 08:41:02] To resume: ./ralph-loop-v2.sh plans/03-action-system 0
JSON_STATUS: {
  "ralph_status": {
    "status": "max_iterations_reached",
    "session_id": "cf6c9e8c-0b4f-4111-af5e-91c3a3e9b6f9",
    "totals": {
      "cost": "0",
      "input_tokens": 2,
      "output_tokens": 7862,
      "duration_ms": 165733
    },
    "progress": {
      "iterations_completed": 1,
      "current_subplan": 2,
      "total_subplans": 9,
      "current_file": ""
    },
    "timestamp": "2026-01-15T08:41:02+00:00"
  }
}
[2026-01-15 08:41:02] 
[2026-01-15 08:41:02] Ralph loop v2 finished with exit code 0
[2026-01-15 08:41:02] Ralph loop terminated
[2026-01-15 08:41:02] Final stats: $0.0000 | 2 in / 7862 out | 2m 45s
JSON_STATUS: {
  "ralph_status": {
    "status": "terminated",
    "session_id": "cf6c9e8c-0b4f-4111-af5e-91c3a3e9b6f9",
    "totals": {
      "cost": "0",
      "input_tokens": 2,
      "output_tokens": 7862,
      "duration_ms": 165733
    },
    "progress": {
      "iterations_completed": 1,
      "current_subplan": 0,
      "total_subplans": 0,
      "current_file": ""
    },
    "timestamp": "2026-01-15T08:41:02+00:00"
  }
}
